[4:00 PM, 1/17/2025] SOPHIE
mysql> CREATE DATABASE ENTERPRISE;
mysql> create database sophie ;
ERROR 1007 (HY000): Can't create database 'sophie'; database exists
mysql> create database imanishimwe ;
Query OK, 1 row affected (0.02 sec)

mysql> use imanishimwe ;
Database changed
mysql> create table client_master (client_no varchar(10) primary key , name varchar(50) ,address varchar(100) ,city varchar(100) , state varchar(50) ,bal_due varchar(40) );
Query OK, 0 rows affected (0.03 sec)

mysql> insert into client_master values ('1' ,'sophie' ,'bumbogo' ,'kigali' ,'kigali' ,'3000' );
Query OK, 1 row affected (0.01 sec)

mysql> insert into client_master values ('2','ange',  'ndera' , 'kigali' ,'kigali' , '4000');
Query OK, 1 row affected (0.00 sec)

mysql> insert into client_master values ('3' ,'betty' , 'muhanga' ,'muhanga' , 'muhanga' , '500' );
Query OK, 1 row affected (0.00 sec)

mysql> insert into client_master values( '4' ,'aron' , 'ruhango' , 'ruhango' , 'ruhande' , '600' );
Query OK, 1 row affected (0.00 sec)

mysql> insert into client_master values( '5' ,'jerome' , 'huye' , 'huye' , 'tumba' , '700' ) ;
Query OK, 1 row affected (0.00 sec)

mysql> select * from client_master ;
+-----------+--------+---------+---------+---------+---------+
| client_no | name   | address | city    | state   | bal_due |
+-----------+--------+---------+---------+---------+---------+
| 1         | sophie | bumbogo | kigali  | kigali  | 3000    |
| 2         | ange   | ndera   | kigali  | kigali  | 4000    |
| 3         | betty  | muhanga | muhanga | muhanga | 500     |
| 4         | aron   | ruhango | ruhango | ruhande | 600     |
| 5         | jerome | huye    | huye    | tumba   | 700     |
+-----------+--------+---------+---------+---------+---------+
5 rows in set (0.00 sec)

mysql> select name from client_master where bal_due > 5000 ;
Empty set (0.00 sec)

mysql> select * from client_master ;
+-----------+--------+---------+---------+---------+---------+
| client_no | name   | address | city    | state   | bal_due |
+-----------+--------+---------+---------+---------+---------+
| 1         | sophie | bumbogo | kigali  | kigali  | 3000    |
| 2         | ange   | ndera   | kigali  | kigali  | 4000    |
| 3         | betty  | muhanga | muhanga | muhanga | 500     |
| 4         | aron   | ruhango | ruhango | ruhande | 600     |
| 5         | jerome | huye    | huye    | tumba   | 700     |
+-----------+--------+---------+---------+---------+---------+
5 rows in set (0.00 sec)

mysql> alter table client_master rename to client12 ;
Query OK, 0 rows affected (0.03 sec)

mysql> select * from client_master ;
ERROR 1146 (42S02): Table 'imanishimwe.client_master' doesn't exist
mysql> alter table client_master rename to client12 ;
ERROR 1146 (42S02): Table 'imanishimwe.client_master' doesn't exist
mysql> alter table client_master rename to client12 ;
ERROR 1146 (42S02): Table 'imanishimwe.client_master' doesn't exist
mysql> select ba_due as balance from client_master ;
ERROR 1146 (42S02): Table 'imanishimwe.client_master' doesn't exist
mysql> select bal_due as balance from client_master ;
ERROR 1146 (42S02): Table 'imanishimwe.client_master' doesn't exist
mysql> alter table client_master rename to client12 ;
ERROR 1146 (42S02): Table 'imanishimwe.client_master' doesn't exist
mysql> alter table client_master change
ERROR 1007 (HY000): Can't create database 'company'; database exists     Q.1
mysql> USE Company;                                   
Database changed
mysql>
mysql> -- Create the EMPLOYEES table with all necessary columns
Query OK, 0 rows affected (0.00 sec)

mysql> CREATE TABLE EMPLOYEES (
    ->     Employee_Id INT PRIMARY KEY,
    ->     First_Name VARCHAR(50) NOT NULL,
    ->     Last_Name VARCHAR(50) NOT NULL,
    ->     Email VARCHAR(100),
    ->     Phone_Number VARCHAR(15),
    ->     Hire_Date DATE,
    ->     Job_Id VARCHAR(10),
    ->     Salary DECIMAL(10, 2) NOT NULL,
    ->     Commission_Pct DECIMAL(5, 2),
    ->     Manager_Id INT,
    ->     Department_Id INT
    -> );
ERROR 1050 (42S01): Table 'employees' already exists
mysql> -- Insert sample data into the EMPLOYEES table
Query OK, 0 rows affected (0.00 sec)

mysql> INSERT INTO EMPLOYEES (Employee_Id, First_Name, Last_Name, Email, Phone_Number, Hire_Date, Job_Id, Salary, Commission_Pct, Manager_Id, Department_Id)
    -> VALUES
    ->     (101, 'John', 'Doe', 'john.doe@example.com', '555-1234', '2020-01-15', 'SA_REP', 5000.00, 0.10, NULL, 60),
    ->     (102, 'Jane', 'Smith', 'jane.smith@example.com', '555-5678', '2019-03-10', 'SA_REP', 6000.00, 0.12, 101, 60),
    ->     (103, 'Alice', 'Austin', 'alice.austin@example.com', '555-9876', '2021-06-21', 'SA_REP', 4800.00, 0.08, 101, 70),
    ->     (104, 'Michael', 'Austin', 'michael.austin@example.com', '555-6543', '2020-11-01', 'IT_PROG', 7000.00, NULL, 102, 70),
    ->     (105, 'Emily', 'Davis', 'emily.davis@example.com', '555-1122', '2022-05-15', 'FI_ACCOUNT', 4500.00, NULL, 102, 80),
    ->     (106, 'Robert', 'Johnson', 'robert.johnson@example.com', '555-3344', '2018-09-03', 'SA_REP', 5200.00, 0.09, 103, 80),
    ->     (107, 'Patricia', 'Williams', 'patricia.williams@example.com', '555-7788', '2017-12-19', 'SA_REP', 6300.00, 0.10, 103, 80),
    ->     (108, 'David', 'Miller', 'david.miller@example.com', '555-5566', '2022-02-18', 'MK_MAN', 4800.00, NULL, 104, 90),
    ->     (109, 'Susan', 'Wilson', 'susan.wilson@example.com', '555-7789', '2020-06-25', 'IT_PROG', 7200.00, NULL, 104, 90),
    ->     (110, 'James', 'Taylor', 'james.taylor@example.com', '555-9900', '2021-08-30', 'SA_REP', 5800.00, 0.11, 104, 90);
ERROR 1054 (42S22): Unknown column 'Email' in 'field list'
mysql> SELECT Employee_Id, First_Name, Last_Name, Salary
    -> FROM EMPLOYEES;
+-------------+------------+-----------+----------+
| Employee_Id | First_Name | Last_Name | Salary   |
+-------------+------------+-----------+----------+
|         101 | John       | Doe       | 50000 .00|
|         102 | Jane       | Smith     | 60000.00 |
|         103 | Alice      | Brown     | 55000.00 |
|         104 | Michael    | White     | 70000.00 |
|         105 | Emily      | Davis     | 45000.00 |
|         106 | Robert     | Johnson   | 52000.00 |
|         107 | Patricia   | Williams  | 63000.00 |
|         108 | David      | Miller    | 48000.00 |
|         109 | Susan      | Wilson    | 72000.00 |
|         110 | James      | Taylor    | 58000.00 |
+-------------+------------+-----------+----------+
10 rows in set (0.00 sec)

mysql> SELECT Employee_Id, First_Name, Last_Name
    -> FROM EMPLOYEES
    -> WHERE Manager_Id = 100;
Empty set (0.00 sec)

mysql> SELECT First_Name, Last_Name
    -> FROM EM…
[4:00 PM, 1/17/2025] Gaby: QUESTION 7

mysql> CREATE DATABASE School;
Query OK, 1 row affected (0.00 sec)

mysql> USE School;
Database changed
mysql>
mysql> -- Step 2: Create the STUDENT table
Query OK, 0 rows affected (0.00 sec)

mysql> CREATE TABLE STUDENT (
    ->     studentId INT PRIMARY KEY,
    ->     fullnames VARCHAR(100) NOT NULL,
    ->     gender ENUM('Male', 'Female', 'Other') NOT NULL,
    ->     age INT NOT NULL,
    ->     department VARCHAR(50) NOT NULL
    -> );
Query OK, 0 rows affected (0.01 sec)

mysql>
mysql> -- Step 3: Insert sample data into the STUDENT table
Query OK, 0 rows affected (0.00 sec)
mysql> CREATE VIEW StudentList AS
    -> SELECT studentId, fullnames, gender, age, department
    -> FROM STUDENT;

mysql> CREATE VIEW StudentList AS
    -> SELECT studentId, fullnames, gender, age, department
    -> FROM STUDENT;
ERROR 1050 (42S01): Table 'StudentList' already exists
mysql> CREATE VIEW GirlList AS
    -> SELECT studentId, fullnames, age, department
    -> FROM STUDENT
    -> WHERE gender = 'Female';

mysql> CREATE VIEW BoyList AS
    -> SELECT studentId, fullnames, age, department
    -> FROM STUDENT
    -> WHERE gender = 'Male';
Query OK, 0 rows affected (0.02 sec)


mysql> INSERT INTO STUDENT (studentId, fullnames, gender, age, department)
    -> VALUES
    -> ('S101', 'John Doe', 'Male', 22, 'accounting finan'),
    -> ('S102', 'Jane Smith', 'Female', 20, 'Business management'),
    -> ('S103', 'Alice Brown', 'Female', 18, 'Engineering'),
    -> ('S104', 'Michael White', 'Male', 19, 'Medicine'),
    -> ('S105', 'Emily Davis', 'Female', 21, 'Law');
ERROR 1062 (23000): Duplicate entry '0' for key 'student.PRIMARY'
mysql> DELETE FROM STUDENT
    -> WHERE age < 20;
Query OK, 0 rows affected (0.00 sec)

mysql> DELETE FROM STUDENT
    -> WHERE age < 20;
Query OK, 0 rows affected (0.00 sec)

mysql>
mysql> SELECT*FROM STUDENT;
+-----------+-----------+--------+-----+------------------+
| studentId | fullnames | gender | age | department       |
+-----------+-----------+--------+-----+------------------+
|         0 | John Doe  | Male   |  22 | accounting finan |
+-----------+-----------+--------+-----+------------------+    Q.7
1 row in set (0.00 sec)

mysql>
[4:06 PM, 1/17/2025] Gaby: mysql> CREATE TABLE Sales (
    ->     Sales_No INT PRIMARY KEY,
    ->     Salesname VARCHAR(50) NOT NULL,
    ->     Branch VARCHAR(50) NOT NULL,
    ->     Salesamount DECIMAL(10, 2) NOT NULL,
    ->     DOB DATE NOT NULL
    -> );
Query OK, 0 rows affected (0.02 sec)

mysql> INSERT INTO Sales (Sales_No, Salesname, Branch, Salesamount, DOB) Q.10
    -> VALUES
    ->     (1, 'John Doe', 'Kigali', 5000.00, '1985-12-15'),
    ->     (2, 'Jane Smith', 'Huye', 6000.00, '1990-03-10'),
    ->     (3, 'Alice Brown', 'Kigali', 4500.00, '1982-12-25'),
    ->     (4, 'Michael White', 'Musanze', 7000.00, '1995-12-05'),
    ->     (5, 'Emily Davis', 'Kigali', 3000.00, '1992-11-17');
Query OK, 5 rows affected (0.00 sec)
Records: 5  Duplicates: 0  Warnings: 0

mysql> SELECT Branch, SUM(Salesamount) AS Total_Salesamount
    -> FROM Sales
    -> GROUP BY Branch;
+---------+-------------------+
| Branch  | Total_Salesamount |
+---------+-------------------+
| Kigali  |          12500.00 |
| Huye    |           6000.00 |
| Musanze |           7000.00 |
+---------+-------------------+
3 rows in set (0.00 sec)

mysql> SELECT Branch, AVG(Salesamount) AS Average_Salesamount
    -> FROM Sales
    -> GROUP BY Branch;
+---------+---------------------+
| Branch  | Average_Salesamount |
+---------+---------------------+
| Kigali  |         4166.666667 |
| Huye    |         6000.000000 |
| Musanze |         7000.000000 |
+---------+---------------------+
3 rows in set (0.00 sec)

mysql> SELECT Salesname, DATE_FORMAT(DOB, '%d-%b-%y') AS DOB
    -> FROM Sales
    -> WHERE MONTH(DOB) = 12;
+---------------+-----------+
| Salesname     | DOB       |
+---------------+-----------+
| John Doe      | 15-Dec-85 |
| Alice Brown   | 25-Dec-82 |
| Michael White | 05-Dec-95 |
+---------------+-----------+
3 rows in set (0.00 sec)

mysql> SELECT Salesname, DATE_FORMAT(DOB, '%b-%d-%Y') AS DOB
    -> FROM Sales
    -> ORDER BY MONTH(DOB), DAY(DOB);
+---------------+-------------+
| Salesname     | DOB         |
+---------------+-------------+
| SOPHIE Smi    | Mar-10-1990 |
| Emily BENJA   | Nov-17-1992 |
| Michael White | Dec-05-1995 |
| John SOSO      | Dec-15-1985 |
| Alice Brown   | Dec-25-1982 |
+---------------+-------------+
5 rows in set (0.00 sec)

mysql>ows affected (0.02 sec)

mysql> INSERT INTO Sales (Sales_No, Salesname, Branch, Salesamount, DOB)
    -> VALUES
    ->     (1, 'John bobo', 'Kigali', 5000.00, '1985-12-15'),
    ->     (2, 'JOHN jaja', 'Huye', 6000.00, '1990-03-10'),
    ->     (3, 'Alice Brown', 'Kigali', 4500.00, '1982-12-25'),
    ->     (4, 'Michael White', 'Musanze', 7000.00, '1995-12-05'),
    ->     (5, 'Emily Davis', 'Kigali', 3000.00, '1992-11-17');
Query OK, 5 rows affected (0.00 sec)
Records: 5  Duplicates: 0  Warnings: 0

mysql> SELECT Branch, SUM(Salesamount) AS Total_Salesamount
    -> FROM Sales
    -> GROUP BY Branch;
+---------+-------------------+
| Branch  | Total_Salesamount |
+---------+-------------------+
| Kigali  |          12500.00 |
| Huye    |           6000.00 |
| Musanze |           7000.00 |
+---------+-------------------+
3 rows in set (0.00 sec)

mysql> SELECT Branch, AVG(Salesamount) AS Average_Salesamount
    -> FROM Sales
    -> GROUP BY Branch;
+---------+---------------------+
| Branch  | Average_Salesamount |
+---------+---------------------+
| Kigali  |         4166.666667 |
| Huye    |         6000.000000 |
| Musanze |         7000.000000 |
+---------+---------------------+
3 rows in set (0.00 sec)

mysql> SELECT Salesname, DATE_FORMAT(DOB, '%d-%b-%y') AS DOB
    -> FROM Sales
    -> WHERE MONTH(DOB) = 12;
+---------------+-----------+
| Salesname     | DOB       |
+---------------+-----------+
| John bobo     | 15-Dec-85 |
| Alice Brown   | 25-Dec-82 |
| Michael White | 05-Dec-95 |
+---------------+-----------+
3 rows in set (0.00 sec)

mysql> SELECT Salesname, DATE_FORMAT(DOB, '%b-%d-%Y') AS DOB
    -> FROM Sales
    -> ORDER BY MONTH(DOB), DAY(DOB);
+---------------+-------------+
| Salesname     | DOB         |
+---------------+-------------+
| John jajaj    | Mar-10-1990 |
| Emily Davis   | Nov-17-1992 |
| Michael White | Dec-05-1995 |
| John bobo      | Dec-15-1985 |
| Alice Brown   | Dec-25-1982 |
+---------------+-------------+
5 rows in set (0.00 sec)

mysql>
